{
  "correlationId": "k1-fixture-corr-disclaimer-0001",
  "tool": "keon.policy.check.v1",
  "ok": true,
  "status": "ok",
  "decision": {
    "policyDecision": "allowed-with-disclaimer",
    "status": "authorize",
    "policyHash": {
      "value": "sha256:cfcfcfcfcfcfcfcfcfcfcfcfcfcfcfcfcfcfcfcfcfcfcfcfcfcfcfcfcfcfcfcf",
      "version": "claim-policy.v1"
    }
  },
  "result": {
    "tenantId": "tenant-keon",
    "disclaimerText": "Stub disclaimer: throughput claim scoped to dry_run proofpack exports."
  },
  "receipts": ["keon://receipt/fixturedisc01"],
  "isError": false
}
